{
  "id": "arbitrary proband id",
  "subject": {
    "id": "proband A",
    "timeAtLastEncounter": {
      "age": {
        "iso8601duration": "P6Y3M"
      }
    },
    "sex": "MALE"
  },
  "phenotypicFeatures": [
    {
      "type": {
        "id": "HP:0001629",
        "label": "Ventricular septal defect"
      },
      "onset": {
        "gestationalAge": {
          "weeks": 23,
          "days": 4
        }
      },
      "evidence": [
        {
          "evidenceCode": {
            "id": "ECO:0000033",
            "label": "author statement supported by traceable reference"
          },
          "reference": {
            "id": "PMID:30808312",
            "description": "COL6A1 mutation leading to Bethlem myopathy with recurrent hematuria: a case report"
          }
        }
      ]
    },
    {
      "type": {
        "id": "HP:0001561",
        "label": "Polyhydramnios"
      },
      "onset": {
        "age": {
          "iso8601duration": "P7D"
        }
      },
      "evidence": [
        {
          "evidenceCode": {
            "id": "ECO:0000033",
            "label": "author statement supported by traceable reference"
          },
          "reference": {
            "id": "PMID:30808312",
            "description": "COL6A1 mutation leading to Bethlem myopathy with recurrent hematuria: a case report"
          }
        }
      ]
    },
    {
      "type": {
        "id": "HP:0000280",
        "label": "Coarse facial features"
      },
      "onset": {
        "ageRange": {
          "start": {
            "iso8601duration": "P14D"
          },
          "end": {
            "iso8601duration": "P21D"
          }
        }
      },
      "evidence": [
        {
          "evidenceCode": {
            "id": "ECO:0000033",
            "label": "author statement supported by traceable reference"
          },
          "reference": {
            "id": "PMID:30808312",
            "description": "COL6A1 mutation leading to Bethlem myopathy with recurrent hematuria: a case report"
          }
        }
      ]
    },
    {
      "type": {
        "id": "HP:0008689",
        "label": "Bilateral cryptorchidism"
      },
      "onset": {
        "ontologyClass": {
          "id": "HP:0003577",
          "label": "Congenital onset"
        }
      },
      "evidence": [
        {
          "evidenceCode": {
            "id": "ECO:0000033",
            "label": "author statement supported by traceable reference"
          },
          "reference": {
            "id": "PMID:30808312",
            "description": "COL6A1 mutation leading to Bethlem myopathy with recurrent hematuria: a case report"
          }
        }
      ]
    },
    {
      "type": {
        "id": "HP:0000054",
        "label": "Micropenis"
      },
      "onset": {
        "timestamp": "2000-01-23T01:23:45.123456789Z"
      },
      "evidence": [
        {
          "evidenceCode": {
            "id": "ECO:0000033",
            "label": "author statement supported by traceable reference"
          },
          "reference": {
            "id": "PMID:30808312",
            "description": "COL6A1 mutation leading to Bethlem myopathy with recurrent hematuria: a case report"
          }
        }
      ]
    },
    {
      "type": {
        "id": "HP:0001798",
        "label": "Anonychia"
      },
      "onset": {
        "interval": {
          "start": "2000-01-23T01:23:45.123456789Z",
          "end": "2001-01-23T01:23:45.123456789Z"
        }
      },
      "evidence": [
        {
          "evidenceCode": {
            "id": "ECO:0000033",
            "label": "author statement supported by traceable reference"
          },
          "reference": {
            "id": "PMID:30808312",
            "description": "COL6A1 mutation leading to Bethlem myopathy with recurrent hematuria: a case report"
          }
        }
      ]
    },
    {
      "type": {
        "id": "HP:0001320",
        "label": "Cerebellar vermis hypoplasia"
      },
      "evidence": [
        {
          "evidenceCode": {
            "id": "ECO:0000033",
            "label": "author statement supported by traceable reference"
          },
          "reference": {
            "id": "PMID:30808312",
            "description": "COL6A1 mutation leading to Bethlem myopathy with recurrent hematuria: a case report"
          }
        }
      ]
    },
    {
      "type": {
        "id": "HP:0000518",
        "label": "Cataract"
      },
      "onset": {
        "ontologyClass": {
          "id": "HP:0003593",
          "label": "Infantile onset"
        }
      },
      "evidence": [
        {
          "evidenceCode": {
            "id": "ECO:0000033",
            "label": "author statement supported by traceable reference"
          },
          "reference": {
            "id": "PMID:30808312",
            "description": "COL6A1 mutation leading to Bethlem myopathy with recurrent hematuria: a case report"
          }
        }
      ]
    },
    {
      "type": {
        "id": "HP:0002198",
        "label": "Dilated fourth ventricle"
      },
      "evidence": [
        {
          "evidenceCode": {
            "id": "ECO:0000033",
            "label": "author statement supported by traceable reference"
          },
          "reference": {
            "id": "PMID:30808312",
            "description": "COL6A1 mutation leading to Bethlem myopathy with recurrent hematuria: a case report"
          }
        }
      ]
    },
    {
      "type": {
        "id": "HP:0100333",
        "label": "Unilateral cleft lip"
      },
      "onset": {
        "ontologyClass": {
          "id": "HP:0003577",
          "label": "Congenital onset"
        }
      },
      "evidence": [
        {
          "evidenceCode": {
            "id": "ECO:0000033",
            "label": "author statement supported by traceable reference"
          },
          "reference": {
            "id": "PMID:30808312",
            "description": "COL6A1 mutation leading to Bethlem myopathy with recurrent hematuria: a case report"
          }
        }
      ]
    }
  ],
  "measurements": [
    {
      "description": "Platelet measurement",
      "assay": {
        "id": "LOINC:26515-7",
        "label": "Platelets [#/volume] in Blood"
      },
      "value": {
        "quantity": {
          "unit": {
            "id": "UO:0000316",
            "label": "cells per microliter"
          },
          "value": 24000.0,
          "referenceRange": {
            "unit": {
              "id": "UO:0000316",
              "label": "cells per microliter"
            },
            "low": 150000.0,
            "high": 450000.0
          }
        }
      },
      "timeObserved": {
        "timestamp": "2020-10-01T10:54:20.123Z"
      },
      "procedure": {
        "code": {
          "id": "C173496",
          "label": "Peripheral Blood"
        },
        "performed": {
          "timestamp": "2020-09-29T10:54:20.012Z"
        }
      }
    },
    {
      "description": "Customized blood pressure measurement description.",
      "assay": {
        "id": "55417-0",
        "label": "Short blood pressure panel"
      },
      "complexValue": {
        "typedQuantities": [
          {
            "type": {
              "id": "NCIT:C25298",
              "label": "Systolic Blood Pressure"
            },
            "quantity": {
              "unit": {
                "id": "NCIT:C49670",
                "label": "Millimeter of Mercury"
              },
              "value": 165.0,
              "referenceRange": {
                "unit": {
                  "id": "NCIT:C49670",
                  "label": "Millimeter of Mercury"
                },
                "low": 110.0,
                "high": 125.0
              }
            }
          },
          {
            "type": {
              "id": "NCIT:C25299",
              "label": "Diastolic Blood Pressure"
            },
            "quantity": {
              "unit": {
                "id": "NCIT:C49670",
                "label": "Millimeter of Mercury"
              },
              "value": 105.0,
              "referenceRange": {
                "unit": {
                  "id": "NCIT:C49670",
                  "label": "Millimeter of Mercury"
                },
                "low": 70.0,
                "high": 80.0
              }
            }
          }
        ]
      },
      "timeObserved": {
        "timestamp": "2020-10-01T10:54:20.123Z"
      }
    }
  ],
  "interpretations": [
    {
      "id": "arbitrary interpretation id",
      "progressStatus": "COMPLETED",
      "diagnosis": {
        "disease": {
          "id": "OMIM:158810",
          "label": "Bethlem myopathy 1"
        },
        "genomicInterpretations": [
          {
            "subjectOrBiosampleId": "arbitrary interpretation id",
            "interpretationStatus": "CAUSATIVE",
            "variantInterpretation": {
              "acmgPathogenicityClassification": "PATHOGENIC",
              "variationDescriptor": {
                "id": "variant id",
                "expressions": [
                  {
                    "syntax": "hgvs",
                    "value": "NM_001848.2:c.877G\u003eA"
                  }
                ],
                "allelicState": {
                  "id": "GENO:0000135",
                  "label": "heterozygous"
                }
              }
            }
          }
        ]
      }
    }
  ],
  "files": [
    {
      "uri": "file://data/file.vcf.gz",
      "individualToFileIdentifiers": {
        "kindred 1A": "SAME000234"
      },
      "fileAttributes": {
        "genomeAssembly": "GRCh38",
        "fileFormat": "vcf"
      }
    }
  ],
  "metaData": {
    "created": "2021-05-14T10:35:00Z",
    "createdBy": "anonymous biocurator",
    "resources": [
      {
        "id": "hp",
        "name": "human phenotype ontology",
        "url": "http://purl.obolibrary.org/obo/hp.owl",
        "version": "2021-08-02",